{"approval_event":"fixture-approval-event","audit_hash":"fixture-audit-hash","claims":[{"calculation_ids":[],"citations":[{"href":"https://www.sec.gov/example#:~:text=Fixture","label":"1","title":"Reporte original · Fixture cell","value":"fixture"}],"claim_id":"thesis","evidence_ids":[],"text":"Fixture lead sentence. This is a fixture claim used only by tests/fixtures/web.","type":"observed_fact"}],"content_hash":"fixture-content-hash","context":["Fixture context sentence."],"evidence_fingerprint":"fixture-evidence-fingerprint","package_id":"fixture-package-id","period_id":"2026Q2","sections":[{"claim_ids":["section_one_claim"],"paragraphs":["Fixture paragraph for section one."],"title":"Fixture section one"},{"claim_ids":["section_two_claim_a","section_two_claim_b"],"paragraphs":["Fixture paragraph for section two.","A second paragraph."],"title":"Fixture section two"}],"summary":["Fixture summary paragraph one.","Fixture summary paragraph two."],"summary_format":"paragraphs","summary_items":[{"claim_id":"thesis","emphasis":["fixture"],"lead":"Fixture lead sentence.","text":"Fixture lead sentence. This is a fixture claim used only by tests/fixtures/web."},{"claim_id":"summary_unit","emphasis":[],"lead":null,"text":"A second fixture claim with no emphasis, for the smoke and parity tests."}],"thesis":"Fixture: Aeroméxico vendió mejor, pero le costó más caro vender","version":"fixture-version","version_event_head":"fixture-version-event-head"}
